clause,law_name,content
《网络安全标准实践指南 — 敏感个人信息识别指南》1 范围,《网络安全标准实践指南 — 敏感个人信息识别指南》, 给出敏感个人信息识别规则及常见类别、示例，用于指导各组织识别敏感个人信息，为处理和保护工作提供参考。
《网络安全标准实践指南 — 敏感个人信息识别指南》2.1 个人信息,《网络安全标准实践指南 — 敏感个人信息识别指南》, 定义为以电子或其他方式记录的与已识别 / 可识别自然人有关的各种信息。
《网络安全标准实践指南 — 敏感个人信息识别指南》2.2 敏感个人信息,《网络安全标准实践指南 — 敏感个人信息识别指南》, 定义为一旦泄露或非法使用，容易导致自然人人格尊严受侵害或人身、财产安全受危害的个人信息，包括生物识别、宗教信仰等信息及不满十四周岁未成年人信息。
《网络安全标准实践指南 — 敏感个人信息识别指南》2.3 个人信息主体,《网络安全标准实践指南 — 敏感个人信息识别指南》, 定义为个人信息所标识或关联的自然人。
《网络安全标准实践指南 — 敏感个人信息识别指南》2.4 个人信息处理者,《网络安全标准实践指南 — 敏感个人信息识别指南》, 定义为在个人信息处理活动中自主决定处理目的、处理方式的组织、个人。
《网络安全标准实践指南 — 敏感个人信息识别指南》3 敏感个人信息识别规则,《网络安全标准实践指南 — 敏感个人信息识别指南》, 个人信息处理者应按以下规则识别：a) 符合 “泄露 / 非法使用易侵害人格尊严、人身安全、财产安全” 任一条件的信息；b) 参照第 4 章及附录 A 识别常见敏感信息；c) 考虑多项信息汇聚后的整体属性；d) 法律法规规定为敏感信息的从其规定。
《网络安全标准实践指南 — 敏感个人信息识别指南》4 常见敏感个人信息,《网络安全标准实践指南 — 敏感个人信息识别指南》, 常见类别包括：a) 生物识别信息；b) 宗教信仰信息；c) 特定身份信息；d) 医疗健康信息；e) 金融账户信息；f) 行踪轨迹信息（特定职业服务履约场景除外）；g) 不满十四周岁未成年人信息；h) 其他符合条件的敏感信息。
《网络安全标准实践指南 — 敏感个人信息识别指南》附录 A 常见敏感个人信息类别示例,《网络安全标准实践指南 — 敏感个人信息识别指南》, 列出各类敏感信息典型示例：- 生物识别信息：基因、人脸、声纹等；- 宗教信仰信息：信仰宗教、宗教组织参与等；- 特定身份信息：残障人士身份等；- 医疗健康信息：病史、就诊记录等；- 其他：精准定位、征信信息等。